title,cluster
The Devil Wears Prada (The Devil Wears Prada #1),0
"The Disappearing Spoon: And Other True Tales of Madness, Love, and the History of the World from the Periodic Table of the Elements",17
"The Elegant Universe: Superstrings, Hidden Dimensions, and the Quest for the Ultimate Theory",0
"The End of Faith: Religion, Terror, and the Future of Reason",30
The Exiled,0
The Girl Who Kicked the Hornet's Nest (Millennium Trilogy #3),7
The Girl Who Played with Fire (Millennium Trilogy #2),26
The Girl with All the Gifts,7
The Giver (The Giver Quartet #1),0
The Goldfinch,0
The Guernsey Literary and Potato Peel Pie Society,0
The Guns of August,0
The Hitchhiker's Guide to the Galaxy (Hitchhiker's Guide to the Galaxy #1),2
The Husband's Secret,3
Shopaholic & Baby (Shopaholic #5),0
Soldier (Talon #3),0
Something Blue (Darcy & Rachel #2),0
Something Borrowed (Darcy & Rachel #1),0
Spilled Milk: Based on a True Story,0
Stiff: The Curious Lives of Human Cadavers,0
"Surely You're Joking, Mr. Feynman!: Adventures of a Curious Character",1
The Art of Fielding,2
"The Art of Simple Food: Notes, Lessons, and Recipes from a Delicious Revolution",10
The Autobiography of Malcolm X,0
The Blind Side: Evolution of a Game,26
The Book of Basketball: The NBA According to The Sports Guy,14
The Book Thief,14
The Case for Christ (Cases for Christianity),0
The Cat in the Hat (Beginner Books B-1),14
The Catcher in the Rye,0
One for the Money (Stephanie Plum #1),35
Orange Is the New Black,3
Original Fake,0
Outliers: The Story of Success,0
Packing for Mars: The Curious Science of Life in the Void,6
Persepolis: The Story of a Childhood (Persepolis #1-2),0
Prodigy: The Graphic Novel (Legend: The Graphic Novel #2),0
Quiet: The Power of Introverts in a World That Can't Stop Talking,5
Ready Player One,35
Red: The True Story of Red Riding Hood,22
Reservations for Two,11
Rework,0
"Rise of the Rocket Girls: The Women Who Propelled Us, from Missiles to the Moon to Mars",7
Rogue Lawyer (Rogue Lawyer #1),0
Running with Scissors,29
"Saga, Volume 3 (Saga (Collected Editions) #3)",33
Lady Renegades (Rebel Belle #3),0
"Lamb: The Gospel According to Biff, Christ's Childhood Pal",3
"Lean In: Women, Work, and the Will to Lead",0
Legend (Legend #1),0
Let's Pretend This Never Happened: A Mostly True Memoir,3
Letter to a Christian Nation,0
Life After Life,6
Life Without a Recipe,6
"Life, the Universe and Everything (Hitchhiker's Guide to the Galaxy #3)",6
Lila (Gilead #3),0
Lust & Wonder,0
Manuscript Found in Accra,0
Me Talk Pretty One Day,13
Midnight Riot (Peter Grant/ Rivers of London - books #1),37
"Miracles from Heaven: A Little Girl, Her Journey to Heaven, and Her Amazing Story of Healing",7
Morning Star (Red Rising #3),22
Golden (Heart of Dread #3),0
Gone Girl,7
Gratitude,0
"Grayson, Vol 3: Nemesis (Grayson #3)",4
Green Eggs and Ham (Beginner Books B-16),14
Heir to the Sky,0
Holidays on Ice,19
Horrible Bear!,0
House of Leaves,0
"House of Lost Worlds: Dinosaurs, Dynasties, and the Story of Life on Earth",17
Hungry Girl Clean & Hungry: Easy All-Natural Recipes for Healthy Eating in the Real World,17
I Am Malala: The Girl Who Stood Up for Education and Was Shot by the Taliban,7
I've Got Your Number,0
If I Run (If I Run #1),29
"In the Garden of Beasts: Love, Terror, and an American Family in Hitler's Berlin",8
Inferno (Robert Langdon #4),0
Cosmos,0
Counting Thyme,0
Crazy Rich Asians (Crazy Rich Asians #1),0
Dark Places,10
Darkfever (Fever #1),0
"David and Goliath: Underdogs, Misfits, and the Art of Battling Giants",13
Dead Wake: The Last Crossing of the Lusitania,32
Disrupted: My Misadventure in the Start-Up Bubble,0
Do Androids Dream of Electric Sheep? (Blade Runner #1),0
Dracula,0
Dune (Dune #1),0
Eclipse (Twilight #3),0
Eragon (The Inheritance Cycle #1),36
Extreme Prey (Lucas Davenport #26),0
Fellside,0
Fifty Shades Freed (Fifty Shades #3),34
Are We Smart Enough to Know How Smart Animals Are?,20
Are We There Yet?,0
Ash,0
Awkward,0
Beautiful Creatures (Caster Chronicles #1),4
Beowulf,0
Best of My Love (Fool's Gold #20),8
Between Shades of Gray,34
Big Little Lies,8
"Black Butler, Vol. 1 (Black Butler #1)",4
Black Flags: The Rise of ISIS,22
Blink: The Power of Thinking Without Thinking,0
"Born to Run: A Hidden Tribe, Superathletes, and the Greatest Race the World Has Never Seen",29
Boy Meets Boy,36
Brave Enough,20
Breaking Dawn (Twilight #4),0
Girl Online On Tour (Girl Online #2),7
H is for Hawk,0
Kindle Paperwhite User's Guide,2
Life,6
New Moon (Twilight #2),3
"Run, Spot, Run: The Ethics of Keeping Pets",29
"Saga, Volume 2 (Saga (Collected Editions) #2)",33
Sugar Rush (Offensive Line #2),0
The Course of Love,8
"The Sandman, Vol. 2: The Doll's House (The Sandman (volumes) #2)",4
The Sense of an Ending,0
"The Suffragettes (Little Black Classics, #96)",1
#GIRLBOSS,0
8 Keys to Mental Health Through Exercise,0
A Heartbreaking Work of Staggering Genius,0
A Storm of Swords (A Song of Ice and Fire #3),19
The Selfish Gene,0
The Silent Twin (Detective Jennifer Knight #3),39
The Silent Wife,39
The Story of Hong Gildong,0
The Tumor,0
"The Wicked + The Divine, Vol. 1: The Faust Act (The Wicked + The Divine)",4
The Zombie Room,0
This One Moment (Pushing Limits #1),35
Three Wishes (River of Time: California #1),18
Travels with Charley: In Search of America,2
Twenty Love Poems and a Song of Despair,21
Vampire Girl (Vampire Girl #1),7
"Vampire Knight, Vol. 1 (Vampire Knight #1)",4
Ways of Seeing,0
When I'm Gone,0
Where Lightning Strikes (Bleeding Stars #3),24
The Communist Manifesto,0
The Complete Maus (Maus #1-2),0
The Edge of Reason (Bridget Jones #2),30
The End of the Jesus Era (An Investigation #1),0
The Girl In The Ice (DCI Erika Foster #1),7
The Girl You Lost,7
The Haters,0
The Hook Up (Game On #1),26
The Iliad,0
The Last Girl (The Dominion Trilogy #1),7
The Light of the Fireflies,27
The Little Prince,1
The Mirror & the Maze (The Wrath and the Dawn #1.5),0
The Name of the Wind (The Kingkiller Chronicle #1),4
The Nicomachean Ethics,0
The No. 1 Ladies' Detective Agency (No. 1 Ladies' Detective Agency #1),0
One Second (Seven #7),35
Origins (Alphas 0.5),0
"Ouran High School Host Club, Vol. 1 (Ouran High School Host Club #1)",4
"Paper Girls, Vol. 1 (Paper Girls #1-5)",7
Paradise Lost (Paradise #1),0
"Rat Queens, Vol. 1: Sass & Sorcery (Rat Queens (Collected Editions) #1-5)",33
"Rhythm, Chord & Malykhin",0
"Saga, Volume 1 (Saga (Collected Editions) #1)",33
Sense and Sensibility,0
Settling the Score (The Summer Games #1),35
Shadow Rites (Jane Yellowrock #10),34
Shameless,0
Shatter Me (Shatter Me #1),0
Sister Sable (The Mad Queen #1),0
"Skip Beat!, Vol. 01 (Skip Beat! #1)",4
Starlark,0
"Fruits Basket, Vol. 1 (Fruits Basket #1)",15
"Giant Days, Vol. 1 (Giant Days #1-4)",13
Having the Barbarian's Baby (Ice Planet Barbarians #7.5),19
"Hawkeye, Vol. 1: My Life as a Weapon (Hawkeye #1)",6
Icing (Aces Hockey #2),19
Imperfect Harmony,0
Jane Eyre,0
Kitchens of the Great Midwest,16
Listen to Me (Fusion #1),0
Lord of the Flies,0
Lost Among the Living,0
Matilda,0
Meditations,0
"Ms. Marvel, Vol. 1: No Normal (Ms. Marvel (2014-2015) #1)",4
My Perfect Mistake (Over the Top #1),0
Myriad (Prentor #1),0
"1,000 Places to See Before You Die",0
1st to Die (Women's Murder Club #1),3
A Spy's Devotion (The Regency Spies of London #1),3
"Ajin: Demi-Human, Volume 1 (Ajin: Demi-Human #1)",0
Beyond Good and Evil,0
"Bleach, Vol. 1: Strawberry and the Soul Reapers (Bleach #1)",4
Blood Defense (Samantha Brinkman #1),0
Bounty (Colorado Mountain #7),0
Bridget Jones's Diary (Bridget Jones #1),3
Bright Lines,0
Charity's Cross (Charles Towne Belles #4),3
Charlie and the Chocolate Factory (Charlie Bucket #1),0
Choosing Our Religion: The Spiritual Lives of America's Nones,3
Deep Under (Walker Security #1),0
"Eat, Pray, Love",8
Emma,0
Fighting Fate (Fighting #6),0
Forever Rockers (The Rocker #12),0
Frankenstein,0
Of Mice and Men,0
Off Sides (Off #1),0
Old Records Never Die: One Man's Quest for His Vinyl and His Past,35
On the Road (Duluoz Legend),1
Taking Shots (Assassins #1),0
The Art of Not Breathing,2
The Bette Davis Club,0
The Bhagavad Gita,0
The Odyssey,0
The Republic,0
"The Sandman, Vol. 1: Preludes and Nocturnes (The Sandman (volumes) #1)",4
The Secret Healer,0
While You Were Mine,0
"Y: The Last Man, Vol. 1: Unmanned (Y: The Last Man #1)",4
Diary of a Minecraft Zombie Book 1: A Scare of a Dare (An Unofficial Minecraft Book),14
"Fruits Basket, Vol. 2 (Fruits Basket #2)",15
A Visit from the Goon Squad,0
A Walk in the Woods: Rediscovering America on the Appalachian Trail,38
And Then There Were None,0
Annie on My Mind,0
Career of Evil (Cormoran Strike #3),24
Catastrophic Happiness: Finding Joy in Childhood's Messy Years,18
Cinder (The Lunar Chronicles #1),4
Civilization and Its Discontents,0
Fire Bound (Sea Haven/Sisters of the Heart #5),19
"Friday Night Lights: A Town, a Team, and a Dream",9
"Fruits Basket, Vol. 3 (Fruits Basket #3)",15
Girl in the Blue Coat,7
Into the Wild,0
Is Everyone Hanging Out Without Me? (And Other Concerns),0
It's Never Too Late to Begin Again: Discovering Creativity and Meaning at Midlife and Beyond,23
Jurassic Park (Jurassic Park #1),0
Naked,0
Neither Here nor There: Travels in Europe,2
Night (The Night Trilogy #1),9
Notes from a Small Island (Notes From a Small Island #1),1
Sarah's Key,3
Scarlet (The Lunar Chronicles #2),4
Seven Brief Lessons on Physics,0
Seven Days in the Art World,17
The Complete Poems,5
The Complete Stories and Poems (The Works of Edgar Allan Poe [Cameo Edition]),5
The Cuckoo's Calling (Cormoran Strike #1),24
The Da Vinci Code (Robert Langdon #2),0
The Infinities,0
"The Land of 10,000 Madonnas",0
The Last Painting of Sara de Vos,0
The Lean Startup: How Today's Entrepreneurs Use Continuous Innovation to Create Radically Successful Businesses,3
The Road to Little Dribbling: Adventures of an American in Britain (Notes From a Small Island #2),1
The Rose & the Dagger (The Wrath and the Dawn #2),0
"The Sandman, Vol. 3: Dream Country (The Sandman (volumes) #3)",4
The Silkworm (Cormoran Strike #2),24
Vegan Vegetarian Omnivore: Dinner for Everyone at the Table,0
Very Good Lives: The Fringe Benefits of Failure and the Importance of Imagination,0
Voyager (Outlander #3),0
Walk the Edge (Thunder Road #2),38
Changing the Game (Play by Play #2),26
Confessions of a Shopaholic (Shopaholic #1),0
Dark Lover (Black Dagger Brotherhood #1),10
Far From True (Promise Falls Trilogy #2),9
"Orchestra of Exiles: The Story of Bronislaw Huberman, the Israel Philharmonic, and the One Thousand Jews He Saved from Nazi Horrors",35
Outlander (Outlander #1),0
Paper and Fire (The Great Library #2),16
Shopaholic Ties the Knot (Shopaholic #3),0
A Feast for Crows (A Song of Ice and Fire #4),19
A Game of Thrones (A Song of Ice and Fire #1),19
A Girl's Guide to Moving On (New Beginnings #2),7
Alight (The Generations Trilogy #2),9
Harry Potter and the Deathly Hallows (Harry Potter #7),12
I Know Why the Caged Bird Sings (Maya Angelou's Autobiography #1),30
If I Stay (If I Stay #1),0
Isla and the Happily Ever After (Anna and the French Kiss #3),0
The 5th Wave (The 5th Wave #1),0
The Crossover,0
The Darkest Corners,0
The Dream Thieves (The Raven Cycle #2),36
Where She Went (If I Stay #2),23
Why Save the Bankers?: And Other Essays on Our Economic and Political Crisis,30
"Will Grayson, Will Grayson (Will Grayson, Will Grayson)",0
World Without End (The Pillars of the Earth #2),17
Pride and Prejudice,0
Ship Leaves Harbor: Essays on Travel by a Recovering Journeyman,2
Tell the Wolves I'm Home,0
The Barefoot Contessa Cookbook,0
A Short History of Nearly Everything,0
A Summer In Europe,35
"At The Existentialist Café: Freedom, Being, and apricot cocktails with: Jean-Paul Sartre, Simone de Beauvoir, Albert Camus, Martin Heidegger, Edmund Husserl, Karl Jaspers, Maurice Merleau-Ponty and others",0
Benjamin Franklin: An American Life,6
Memoirs of a Geisha,0
Meternity,0
"Naturally Lean: 125 Nourishing Gluten-Free, Plant-Based Recipes--All Under 300 Calories",0
Nightstruck: A Novel,0
The Good Girl,7
The Great Gatsby,16
The Origin of Species,0
The Story of Art,2
Diary of a Citizen Scientist: Chasing Tiger Beetles and Other New Ways of Engaging the World,17
Ender's Game (The Ender Quintet #1),26
Future Shock (Future Shock #1),0
Heaven is for Real: A Little Boy's Astounding Story of His Trip to Heaven and Back,36
Please Kill Me: The Uncensored Oral History of Punk,0
Proofs of God: Classical Arguments from Tertullian to Barth,0
Rising Strong,22
Roller Girl,7
A Hero's Curse (The Unseen Chronicles #1),4
A Shard of Ice (The Black Symphony Saga #1),0
Art and Fear: Observations on the Perils (and Rewards) of Artmaking,2
Chernobyl 01:23:40: The Incredible True Story of the World's Worst Nuclear Disaster,17
Underlying Notes,10
Unlimited Intuition Now,0
Watchmen,0
Without Shame,0
Lilac Girls,7
M Train,0
"Mother, Can You Not?",0
Mothering Sunday,0
Equal Is Unfair: America's Misguided Fight Against Income Inequality,3
Everyday Italian: 125 Simple and Delicious Recipes,0
Furiously Happy: A Funny Book About Horrible Things,14
Hide Away (Eve Duncan #20),0
The Golden Condom: And Other Essays on Love Lost and Found,8
The Gray Rhino: How to Recognize and Act on the Obvious Dangers We Ignore,8
The Lonely City: Adventures in the Art of Being Alone,25
The Midnight Watch: A Novel of the Titanic and the Californian,37
A Time of Torment (Charlie Parker #14),18
Abstract City,25
"Adulthood Is a Myth: A ""Sarah's Scribbles"" Collection",3
All the Light We Cannot See,27
City of Fallen Angels (The Mortal Instruments #4),25
City of Glass (The Mortal Instruments #3),25
Clockwork Angel (The Infernal Devices #1),38
Code Name Verity (Code Name Verity #1),0
God: The Most Unpleasant Character in All Fiction,0
Greek Mythic History,0
Hamilton: The Revolution,0
Hold Your Breath (Search and Rescue #1),0
Mr. Mercedes (Bill Hodges Trilogy #1),9
My Kind of Crazy,0
My Mrs. Brown,0
My Name Is Lucy Barton,0
Steve Jobs,0
Still Life with Bread Crumbs,6
Superman Vol. 1: Before Truth (Superman by Gene Luen Yang #1),4
Swell: A Year of Waves,0
The Long Haul (Diary of a Wimpy Kid #9),0
The Lucifer Effect: Understanding How Good People Turn Evil,0
The Marriage of Opposites,0
The Power of Habit: Why We Do What We Do in Life and Business,30
Walt Disney's Alice in Wonderland,3
"We Are Robin, Vol. 1: The Vigilante Business (We Are Robin #1)",4
What's It Like in Space?: Stories from Astronauts Who've Been There,18
Whole Lotta Creativity Going On: 60 Fun and Unusual Exercises to Awaken and Strengthen Your Creativity,3
Chasing Heaven: What Dying Taught Me About Living,0
Close to You,0
"Daring Greatly: How the Courage to Be Vulnerable Transforms the Way We Live, Love, Parent, and Lead",16
Dark Notes,10
Little Red,22
Louisa: The Extraordinary Life of Mrs. Adams,6
Miss Peregrine’s Home for Peculiar Children (Miss Peregrine’s Peculiar Children #1),31
Modern Romance,0
The Argonauts,0
The Art of War,2
The Artist's Way: A Spiritual Path to Higher Creativity,3
The Psychopath Test: A Journey Through the Madness Industry,0
The Regional Office Is Under Attack!,0
The Secret (The Secret #1),0
The Shadow Hero (The Shadow Hero),34
A Murder in Time,18
"A Piece of Sky, a Grain of Rice: A Memoir in Four Meditations",0
A World of Flavor: Your Gluten Free Passport,17
Algorithms to Live By: The Computer Science of Human Decisions,0
How to Be Miserable: 40 Strategies You Already Use,0
I am a Hero Omnibus Volume 1,0
"I Hate Fairyland, Vol. 1: Madly Ever After (I Hate Fairyland (Compilations) #1-5)",4
Immunity: How Elie Metchnikoff Changed the Course of Modern Medicine,26
"Political Suicide: Missteps, Peccadilloes, Bad Calls, Backroom Hijinx, Sordid Pasts, Rotten Breaks, and Just Plain Dumb Mistakes in the Annals of American Politics",1
"Pop Gun War, Volume 1: Gift",0
Princess Between Worlds (Wide-Awake Princess #5),17
"Princess Jellyfish 2-in-1 Omnibus, Vol. 01 (Princess Jellyfish 2-in-1 Omnibus #1)",4
"The Mindfulness and Acceptance Workbook for Anxiety: A Guide to Breaking Free from Anxiety, Phobias, and Worry Using Acceptance and Commitment Therapy",32
The Most Perfect Thing: Inside (and Outside) a Bird's Egg,3
The Murder That Never Was (Forensic Instincts #5),0
The Nameless City (The Nameless City #1),25
#HigherSelfie: Wake Up Your Life. Free Your Soul. Find Your Tribe.,32
Private Paris (Private #10),0
Reasons to Stay Alive,30
Slow States of Collapse: Poems,5
"Foolproof Preserving: A Guide to Small Batch Jams, Jellies, Pickles, Condiments, and More: A Foolproof Guide to Making Small Batch Jams, Jellies, Pickles, Condiments, and More",1
How Music Works,0
In Her Wake,32
