title,cluster
Sapiens: A Brief History of Humankind,0
Sharp Objects,0
Soumission,0
Tipping the Velvet,0
A Light in the Attic,27
It's Only the Himalayas,3
Libertarianism for Beginners,0
Mesaerion: The Best Science Fiction Stories 1800-1849,0
Olio,0
"Our Band Could Be Your Life: Scenes from the American Indie Underground, 1981-1991",6
Rip it Up and Start Again,0
Scott Pilgrim's Precious Little Life (Scott Pilgrim #1),6
Set Me Free,32
Shakespeare's Sonnets,3
"Starving Hearts (Triangular Trade Trilogy, #1)",9
The Black Maria,0
The Boys in the Boat: Nine Americans and Their Epic Quest for Gold at the 1936 Berlin Olympics,36
"The Coming Woman: A Novel Based on the Life of the Infamous Feminist, Victoria Woodhull",6
The Dirty Little Secrets of Getting Your Dream Job,1
The Requiem Red,22
Aladdin and His Wonderful Lamp,0
You can't bury them all: Poems,5
Behind Closed Doors,0
"In a Dark, Dark Wood",10
Maude (1883-1993):She Grew Up with the country,0
Penny Maybe,0
Sophie's World,17
The Bear and the Piano,0
The Elephant Tree,0
The Five Love Languages: How to Express Heartfelt Commitment to Your Mate,8
The Four Agreements: A Practical Guide to Personal Freedom,2
Wall and Piece,0
Worlds Elsewhere: Journeys Around Shakespeare’s Globe,17
America's Cradle of Quarterbacks: Western Pennsylvania's Football Factory from Johnny Unitas to Joe Montana,3
Birdsong: A Story in Pictures,0
Black Dust,0
Chase Me (Paris Nights #2),9
The Natural History of Us (The Fine Art of Pretending #2),2
The Past Never Ends,0
"The Pioneer Woman Cooks: Dinnertime: Comfort Classics, Freezer Food, 16-Minute Meals, and Other Delicious Ways to Solve Supper!",0
The Secret of Dreadwillow Carse,0
The Torch Is Passed: A Harding Family Story,0
Thirst,0
This One Summer,35
Throwing Rocks at the Google Bus: How Growth Became the Enemy of Prosperity,0
Tsubasa: WoRLD CHRoNiCLE 2 (Tsubasa WoRLD CHRoNiCLE #2),17
"Unbound: How Eight Technologies Made Us Human, Transformed Society, and Brought Our World to the Brink",17
Unicorn Tracks,0
"Unseen City: The Majesty of Pigeons, the Discreet Charm of Snails & Other Wonders of the Urban Wilderness",25
Untitled Collection: Sabbath Poems 2014,5
"We Love You, Charlie Freeman",8
When We Collided,0
Without Borders (Wanderlove #1),0
"Rat Queens, Vol. 3: Demons (Rat Queens (Collected Editions) #11-15)",33
Reskilling America: Learning to Labor in the Twenty-First Century,0
"Saga, Volume 5 (Saga (Collected Editions) #5)",33
"Saga, Volume 6 (Saga (Collected Editions) #6)",33
Security,0
Soul Reader,32
Spark Joy: An Illustrated Master Class on the Art of Organizing and Tidying Up,2
The Activist's Tao Te Ching: Ancient Advice for a Modern Revolution,3
The Age of Genius: The Seventeenth Century and the Birth of the Modern Mind,0
The Art Forger,2
"The Bulletproof Diet: Lose up to a Pound a Day, Reclaim Energy and Focus, Upgrade Your Life",13
The Death of Humanity: and the Case for Life,6
The Electric Pencil: Drawings from Inside State Hospital No. 3,0
The Gutsy Girl: Escapades for Your Life of Epic Adventure,7
"The Inefficiency Assassin: Time Management Tactics for Working Smarter, Not Longer",18
The Life-Changing Magic of Tidying Up: The Japanese Art of Decluttering and Organizing,34
In the Country We Love: My Family Divided,8
Join,0
Judo: Seven Steps to Black Belt (an Introductory Guide for Beginners),2
"Layered: Baking, Building, and Styling Spectacular Cakes",0
Lumberjanes Vol. 3: A Terrible Plan (Lumberjanes #9-12),4
"Lumberjanes, Vol. 1: Beware the Kitten Holy (Lumberjanes #1-4)",4
"Lumberjanes, Vol. 2: Friendship to the Max (Lumberjanes #5-8)",4
"Mama Tried: Traditional Italian Cooking for the Screwed, Crude, Vegan, and Tattooed",0
Masks and Shadows,34
My Paris Kitchen: Recipes and Stories,0
Obsidian (Lux #1),0
On a Midnight Clear,37
Online Marketing for Busy Authors: A Step-By-Step Guide,2
orange: The Complete Collection 1 (orange: The Complete Collection #1),0
"Outcast, Vol. 1: A Darkness Surrounds Him (Outcast #1)",10
Patience,0
"Avatar: The Last Airbender: Smoke and Shadow, Part 3 (Smoke and Shadow #3)",34
"Bitch Planet, Vol. 1: Extraordinary Machine (Bitch Planet (Collected Editions))",0
Bossypants,0
Burning,0
Call the Nurse: True Stories of a Country Nurse on a Scottish Isle,0
Camp Midnight,37
"Codename Baboushka, Volume 1: The Conclave of Death",0
Crown of Midnight (Throne of Glass #2),37
Danganronpa Volume 1,0
"Don't Be a Jerk: And Other Practical Advice from Dogen, Japan's Greatest Zen Master",5
Everydata: The Misinformation Hidden in the Little Data You Consume Every Day,13
Fifty Shades Darker (Fifty Shades #2),34
First and First (Five Boroughs #3),0
Forever and Forever: The Courtship of Henry Longfellow and Fanny Appleton,0
"Giant Days, Vol. 2 (Giant Days #5-8)",13
Her Backup Boyfriend (The Sorensen Family #1),0
The Stranger,0
The Third Wave: An Entrepreneur’s Vision of the Future,0
The Vacationers,0
The Wedding Dress,0
The White Cat and the Monk: A Retelling of the Poem “Pangur Bán”,5
Thirteen Reasons Why,30
Thomas Jefferson and the Tripoli Pirates: The Forgotten War That Changed American History,26
Throne of Glass (Throne of Glass #1),37
Tracing Numbers on a Train,0
Tuesday Nights in 1980,9
"William Shakespeare's Star Wars: Verily, A New Hope (William Shakespeare's Star Wars #4)",22
You Are What You Love: The Spiritual Power of Habit,8
(Un)Qualified: How God Uses Broken People to Do Big Things,14
A Court of Thorns and Roses (A Court of Thorns and Roses #1),0
A Fierce and Subtle Poison,0
A Flight of Arrows (The Pathfinders #2),0
The Cookies & Cups Cookbook: 125+ sweet & savory recipes reminding you to Always Eat Dessert First,0
The Emerald Mystery,0
The Genius of Birds,0
The Girl on the Train,7
The Glittering Court (The Glittering Court #1),0
The House by the Lake,0
The Kite Runner,0
The Long Shadow of Small Ghosts: Murder and Memory in an American City,1
The Love and Lemons Cookbook: An Apple-to-Zucchini Celebration of Impromptu Cooking,8
The Matchmaker's Playbook (Wingmen Inc. #1),3
The Mistake (Off-Campus #2),0
The Murder of Roger Ackroyd (Hercule Poirot #4),0
The Nerdy Nummies Cookbook: Sweet Treats for the Geek in All of Us,0
The Omnivore's Dilemma: A Natural History of Four Meals,3
The Power of Now: A Guide to Spiritual Enlightenment,2
The Project,0
Mrs. Houdini,0
Night Sky with Exit Wounds,9
"Nightingale, Sing",0
Poems That Make Grown Women Cry,5
Poses for Artists Volume 1 - Dynamic and Sitting Poses: An Essential Reference for Figure Drawing and the Human Form,0
Redeeming Love,8
Romero and Juliet: A Tragic Tale of Love and Zombies,8
Scarlett Epstein Hates It Here,0
Secrets and Lace (Fatal Hearts #1),0
"Shobu Samurai, Project Aryoku (#3)",0
Shoe Dog: A Memoir by the Creator of NIKE,0
So You've Been Publicly Shamed,0
Soft Apocalypse,0
Something More Than This,0
Suddenly in Love (Lake Haven #1),8
The 10% Entrepreneur: Live Your Startup Dream Without Quitting Your Day Job,13
"Deliciously Ella Every Day: Quick and Easy Recipes for Gluten-Free Snacks, Packed Lunches, and Simple Meals",13
Doing It Over (Most Likely To #1),18
Done Rubbed Out (Reightman & Bailey #1),0
Drive: The Surprising Truth About What Motivates Us,0
Eureka Trivia 6.0,0
"Fables, Vol. 1: Legends in Exile (Fables #1)",4
Finders Keepers (Bill Hodges Trilogy #2),9
First Steps for New Christians (Print Edition),0
Follow You Home,0
Frostbite (Vampire Academy #2),0
Full Moon over Noah’s Ark: An Odyssey to Mount Ararat and Beyond,23
Grumbles,0
Hollow City (Miss Peregrine’s Peculiar Children #2),31
I Had a Nice Time And Other Lies...: How to find love & sh*t like that,18
Large Print Heart of the Pride,0
Library of Souls (Miss Peregrine’s Peculiar Children #3),31
Why the Right Went Wrong: Conservatism--From Goldwater to the Tea Party and Beyond,23
Wild Swans,0
"Wonder Woman: Earth One, Volume One (Wonder Woman: Earth One #1)",35
You (You #1),0
Zealot: The Life and Times of Jesus of Nazareth,6
Agnostic: A Spirited Manifesto,0
Amatus,0
Amid the Chaos,0
Amy Meets the Saints and Sages,0
Anonymous,0
Ayumi's Violin,3
Batman: The Dark Knight Returns (Batman),10
Batman: The Long Halloween (Batman),0
Beauty Restored (Riley Family Legacy Novellas #3),0
Becoming Wise: An Inquiry into the Mystery and Art of Living,2
Big Magic: Creative Living Beyond Fear,34
The Rosie Project (Don Tillman #1),0
The Song of Achilles,19
The Songs of the Gods,19
The Star-Touched Queen,0
The Testament of Mary,0
The Time Keeper,18
The Wedding Pact (The O'Malleys #2),0
The White Queen (The Cousins' War #1),0
The Wright Brothers,0
The Year of Magical Thinking,34
This Is Where It Ends,0
Through the Woods,0
Twenty Yawns,21
"Unbroken: A World War II Story of Survival, Resilience, and Redemption",17
Until Friday Night (The Field Party #1),9
V for Vendetta (V for Vendetta Complete),0
Take Me with You,0
Tastes Like Fear (DI Marnie Rome #3),18
That Darkness (Gardiner and Renner #1),10
The 14th Colony (Cotton Malone #11),0
The Bad-Ass Librarians of Timbuktu: And Their Race to Save the World’s Most Precious Manuscripts,17
The Bane Chronicles (The Bane Chronicles #1-11),4
The Darkest Lie,8
The Dovekeepers,0
The First Hostage (J.B. Collins #2),0
The Guilty (Will Robie #4),0
The Help Yourself Cookbook for Kids: 60 Easy Plant-Based Recipes Kids Can Make to Stay Healthy and Save the Earth,3
The Hidden Oracle (The Trials of Apollo #1),0
The Immortal Life of Henrietta Lacks,6
The Last Mile (Amos Decker #2),0
The Literature Book (Big Ideas Simply Explained),14
The Loney,0
"Naruto (3-in-1 Edition), Vol. 14: Includes Vols. 40, 41 & 42 (Naruto: Omnibus #14)",4
No Dream Is Too High: Life Lessons From a Man Who Walked on the Moon,38
Old School (Diary of a Wimpy Kid #10),0
Once Was a Time,18
"Overload: How to Unplug, Unwind, and Unleash Yourself from the Pressure of Stress",0
Pet Sematary,0
"Quarter Life Poetry: Poems for the Young, Broke and Hangry",6
Rain Fish,0
"Red Hood/Arsenal, Vol. 1: Open for Business (Red Hood/Arsenal #1)",22
Robin War,0
salt.,0
See America: A Celebration of Our National Parks & Treasured Sites,0
Shtum,0
"So Cute It Hurts!!, Vol. 6 (So Cute It Hurts!! #6)",4
Someone Like You (The Harrisons #2),18
Sorting the Beef from the Bull: The Science of Food Fraud Forensics,0
"Hush, Hush (Hush, Hush #1)",0
"Hyperbole and a Half: Unfortunate Situations, Flawed Coping Mechanisms, Mayhem, and Other Things That Happened",0
I Am Pilgrim (Pilgrim #1),0
I Know What I'm Doing -- and Other Lies I Tell Myself: Dispatches from a Life Under Construction,8
Island of Dragons (Unwanteds #7),1
"It's All Easy: Healthy, Delicious Weeknight Meals in under 30 Minutes",3
Lady Midnight (The Dark Artifices #1),10
Let It Out: A Journey Through Journaling,0
"Living Leadership by Insight: A Good Leader Achieves, a Great Leader Builds Monuments",0
Looking for Lovely: Collecting the Moments that Matter,0
Love Is a Mix Tape (Music #1),8
Lowriders to the Center of the Earth (Lowriders in Space #2),3
Luckiest Girl Alive,7
Luis Paints the World,17
Made to Stick: Why Some Ideas Survive and Others Die,30
More Than Music (Chasing the Dream #1),0
Cometh the Hour (The Clifton Chronicles #6),4
Crazy Love: Overwhelmed by a Relentless God,8
Daily Fantasy Sports,0
Dear Mr. Knightley,0
Demigods & Magicians: Percy and Annabeth Meet the Kanes (Percy Jackson & Kane Chronicles Crossover #1-3),4
Doctor Sleep (The Shining #2),0
Don't Get Caught,5
"Eat Fat, Get Thin",0
"Eaternity: More than 150 Deliciously Easy Vegan Recipes for a Long, Healthy, Satisfied, Joyful Life",6
Eight Hundred Grapes,0
El Deafo,0
Eligible (The Austen Project #4),0
Every Last Word,0
"Far & Away: Places on the Brink of Change: Seven Continents, Twenty-Five Years",26
Feathers: Displays of Brilliant Plumage,0
Glory over Everything: Beyond The Kitchen House,23
Angels & Demons (Robert Langdon #1),38
Angels Walking (Angels Walking #1),38
Aristotle and Dante Discover the Secrets of the Universe (Aristotle and Dante Discover the Secrets of the Universe #1),0
Art Ops Vol. 1,4
Balloon Animals,20
Barefoot Contessa at Home: Everyday Recipes You'll Make Over and Over Again,0
Barefoot Contessa Back to Basics,0
Batman: Europa,0
Brain on Fire: My Month of Madness,19
Buying In: The Secret Dialogue Between What We Buy and Who We Are,0
Carrie,0
"Carry On, Warrior: Thoughts on Life Unarmed",6
Catching Jordan (Hundred Oaks),0
Cell,0
City of Ashes (The Mortal Instruments #2),25
City of Bones (The Mortal Instruments #1),25
The Silent Sister (Riley MacPherson #1),39
The Star-Touched Queen,0
Tipping Point for Planet Earth: How Close Are We to the Edge?,3
Will You Won't You Want Me?,5
13 Hours: The Inside Account of What Really Happened In Benghazi,0
My Kitchen Year: 136 Recipes That Saved My Life,6
Rook,0
Searching for Meaning in Gailana,0
"The Three Searches, Meaning, and the Story",0
1491: New Revelations of the Americas Before Columbus,3
A Brush of Wings (Angels Walking #3),38
A Distant Mirror: The Calamitous 14th Century,0
A Man Called Ove,0
A People's History of the United States,3
"A Series of Catastrophes and Miracles: A True Story of Love, Science, and Cancer",8
A Study in Scarlet (Sherlock Holmes #1),0
How to Speak Golf: An Illustrated Guide to Links Lingo,2
"Love, Lies and Spies",8
Most Wanted,0
Murder at the 42nd Street Library (Raymond Ambler #1),0
No Love Allowed (Dodge Cove #1),8
One with You (Crossfire #5),35
Poisonous (Max Revere Novels #3),0
Psycho: Sanitarium (Psycho #1.5),0
Quench Your Own Thirst: Business Lessons Learned Over a Beer or Two,11
Raspberry Pi Electronics Projects for the Evil Genius,0
Snatched: How A Drug Queen Went Undercover for the DEA and Was Kidnapped By Colombian Guerillas,23
Stars Above (The Lunar Chronicles #4.5),4
The Children,31
The Diary of a Young Girl,7
The Dinner Party,23
The Epidemic (The Program 0.6),0
Off the Hook (Fishing for Trouble #1),0
Playing with Fire,26
"Setting the World on Fire: The Brief, Astonishing Life of St. Catherine of Siena",17
Sleeping Giants (Themis Files #1),13
Take Me Home Tonight (Rock Star Romance #3),22
The Art of Startup Fundraising,2
The Improbability of Love,8
"The Sleep Revolution: Transforming Your Life, One Night at a Time",9
The Widow,0
Troublemaker: Surviving Hollywood and Scientology,0
"A la Mode: 120 Recipes in 60 Pairings: Pies, Tarts, Cakes, Crisps, and More Topped with Ice Cream, Gelato, Frozen Custard, and More",19
A Paris Apartment,0
Boar Island (Anna Pigeon #19),1
Can You Keep a Secret? (Fear Street Relaunch #4),0
Dirty (Dive Bar #1),0
Eleanor & Park,0
10-Day Green Smoothie Cleanse: Lose Up to 15 Pounds in 10 Days!,13
"10% Happier: How I Tamed the Voice in My Head, Reduced Stress Without Losing My Edge, and Found Self-Help That Actually Works",0
11/22/63,0
A Gentleman's Position (Society of Gentlemen #3),3
A Mother's Reckoning: Living in the Aftermath of Tragedy,3
Adultery,0
Arena,0
Born for This: How to Find the Work You Were Meant to Do,18
Cravings: Recipes for What You Want to Eat,0
Daredevils,0
"Exit, Pursued by a Bear",0
Grey (Fifty Shades #4),34
It Didn't Start with You: How Inherited Family Trauma Shapes Who We Are and How to End the Cycle,36
Keep Me Posted,0
Lab Girl,7
Lies and Other Acts of Love,8
Don't Forget Steven,5
Dress Your Family in Corduroy and Denim,0
"Fruits Basket, Vol. 9 (Fruits Basket #9)",15
If I Gave You God's Phone Number....: Searching for Spirituality in America,3
Modern Day Fables,13
"NaNo What Now? Finding your editing process, revising your NaNoWriMo book and building a writing career through publishing and beyond",24
Nap-a-Roo,0
Suzie Snowflake: One beautiful flake (a self-esteem story),35
The Alien Club,0
The Art and Science of Low Carbohydrate Living,2
The Book of Mormon,14
"The Fabric of the Cosmos: Space, Time, and the Texture of Reality",18
The Flowers Lied,8
"The Moosewood Cookbook: Recipes from Moosewood Restaurant, Ithaca, New York",3
The New Brand You: Your New Image Makes the Sale for You,3
The Shack,0
Shadows of the Past (Logan Point #1),34
Silence in the Dark (Logan Point #4),10
Smarter Faster Better: The Secrets of Being Productive in Life and Business,6
South of Sunshine,0
The E-Myth Revisited: Why Most Small Businesses Don't Work and What to Do About It,30
The Grownup,0
The High Mountains of Portugal,0
The Martian (The Martian #1),0
"The Midnight Assassin: Panic, Scandal, and the Hunt for America's First Serial Killer",37
The New Drawing on the Right Side of the Brain,23
The Unlikely Pilgrimage of Harold Fry (Harold Fry #1),0
Vagabonding: An Uncommon Guide to the Art of Long-Term World Travel,2
When Breath Becomes Air,0
Why Not Me?,30
"Zero to One: Notes on Startups, or How to Build the Future",10
23 Degrees South: A Tropical Tale of Changing Whether...,26
History of Beauty,0
Howl and Other Poems,5
Hystopia: A Novel,0
I Will Find You,18
I'll Give You the Sun,0
John Vassos: Industrial Design for Modern Life,6
Kierkegaard: A Christian Missionary to Christians,0
Kill 'Em and Leave: Searching for James Brown and the American Soul,32
Left Behind (Left Behind #1),0
Les Fleurs du Mal,0
Living Forward: A Proven Plan to Stop Drifting and Get the Life You Want,6
"Love That Boy: What Two Presidents, Eight Road Trips, and My Son Taught Me About a Parent's Expectations",11
Man's Search for Meaning,3
Miller's Valley,3
My Life Next Door (My Life Next Door ),6
Out of Print: City Lights Spotlight No. 14,27
The Whale,0
The Year of Living Biblically: One Man's Humble Quest to Follow the Bible as Literally as Possible,35
Toddlers Are A**holes: It's Not Your Fault,3
Under the Tuscan Sun,0
Unreasonable Hope: Finding Faith in the God Who Brings Purpose to Your Pain,3
What Happened on Beale Street (Secrets of the South Mysteries #2),0
Wildlife of New York: A Five-Borough Coloring Book,3
You Are a Badass: How to Stop Doubting Your Greatness and Start Living an Awesome Life,16
"""Most Blessed of the Patriarchs"": Thomas Jefferson and the Empire of the Imagination",0
32 Yolks,0
"A Murder Over a Girl: Justice, Gender, Junior High",7
Being Mortal: Medicine and What Matters in the End,25
Between the World and Me,17
Brazen: The Courage to Find the You That's Been Hiding,18
Brilliant Beacons: A History of the American Lighthouse,1
Death by Leisure: A Cautionary Tale,0
Playing from the Heart,26
Raymie Nightingale,0
"Rich Dad, Poor Dad",0
"Shrunken Treasures: Literary Classics, Short, Sweet, and Silly",0
Sister Dear,0
"Sit, Stay, Love",8
Steal Like an Artist: 10 Things Nobody Told You About Being Creative,18
Team of Rivals: The Political Genius of Abraham Lincoln,0
The 7 Habits of Highly Effective People: Powerful Lessons in Personal Change,26
The Art Book,14
The Bachelor Girl's Guide to Murder (Herringford and Watts Mysteries #1),7
The Bourne Identity (Jason Bourne #1),0
The Constant Princess (The Tudor Court #1),0
The Drowning Girls,7
The Faith of Christopher Hitchens: The Restless Soul of the World's Most Notorious Atheist,17
The Glass Castle,37
Blue Like Jazz: Nonreligious Thoughts on Christian Spirituality,18
"Chronicles, Vol. 1",4
Counted With the Stars (Out from Egypt #1),22
Delivering the Truth (Quaker Midwife Mystery #1),0
Every Heart a Doorway (Every Heart A Doorway #1),0
Finding God in the Ruins: How God Redeems Pain,18
For the Love: Fighting for Grace in a World of Impossible Standards,17
"Fruits Basket, Vol. 7 (Fruits Basket #7)",15
Good in Bed (Cannie Shapiro #1),0
How to Be a Domestic Goddess: Baking and the Art of Comfort Cooking,2
How to Cook Everything Vegetarian: Simple Meatless Recipes for Great Food (How to Cook Everything),16
John Adams,0
King's Folly (The Kinsman Chronicles #1),4
Leave This Song Behind: Teen Poetry at Its Best,19
Life of Pi,6
Like Never Before (Walker Family #2),18
The Collected Poems of W.B. Yeats (The Collected Works of W.B. Yeats #1),0
The Fellowship of the Ring (The Lord of the Rings #1),0
The Girl You Left Behind (The Girl You Left Behind #1),7
The God Delusion,0
The Golden Compass (His Dark Materials #1),10
The Great Railway Bazaar,16
The Hobbit (Middle-Earth Universe),0
The Invention of Wings,0
The Joy of Cooking,0
The Makings of a Fatherless Child,0
The Man Who Mistook His Wife for a Hat and Other Clinical Tales,39
The Mysterious Affair at Styles (Hercule Poirot #1),0
The Perks of Being a Wallflower,0
The Rise and Fall of the Third Reich: A History of Nazi Germany,22
The Sound Of Love,8
A Gathering of Shadows (Shades of Magic #2),34
A Year in Provence (Provence #1),0
An Unquiet Mind: A Memoir of Moods and Madness,0
Better Homes and Gardens New Cook Book,3
Catherine the Great: Portrait of a Woman,16
"Death Note, Vol. 6: Give-and-Take (Death Note #6)",10
Deception Point,0
"Fruits Basket, Vol. 6 (Fruits Basket #6)",15
Fun Home: A Family Tragicomic,0
"Girl, Interrupted",7
Give It Back,0
How to Stop Worrying and Start Living,0
In Cold Blood,0
In the Woods (Dublin Murder Squad #1),0
Me Before You (Me Before You #1),0
Mere Christianity,0
Musicophilia: Tales of Music and the Brain,0
The Expatriates,0
The False Prince (The Ascendance Trilogy #1),9
The Fault in Our Stars,22
The Firm,0
The Grand Design,0
The Hiding Place,0
The Little Paris Bookshop,1
The Mathews Men: Seven Brothers and the War Against Hitler's U-boats,3
The Metamorphosis,0
The Power Greens Cookbook: 140 Delicious Superfood Recipes,0
The Raven Boys (The Raven Cycle #1),36
The Raven King (The Raven Cycle #4),36
The Secret Garden,0
This Is Your Brain on Music: The Science of a Human Obsession,0
Two Summers,11
What If?: Serious Scientific Answers to Absurd Hypothetical Questions,0
Kill the Boy Band,36
Killing Floor (Jack Reacher #1),0
Last One Home (New Beginnings #1),35
Logan Kade (Fallen Crest High #5.5),25
Lola and the Boy Next Door (Anna and the French Kiss #2),36
Maybe Something Beautiful: How Art Transformed a Neighborhood,2
Mexican Today: New and Rediscovered Recipes for Contemporary Kitchens,3
My Mother Was Nuts,0
Peak: Secrets from the New Science of Expertise,3
Red Dragon (Hannibal Lecter #1),22
Remember Me?,28
Shiver (The Wolves of Mercy Falls #1),0
Siddhartha,0
Talking to Girls About Duran Duran: One Young Man's Quest for True Love and a Cooler Haircut,35
Tell Me Three Things,0
Tell the Wind and Fire,19
America's War for the Greater Middle East: A Military History,3
An Abundance of Katherines,0
Approval Junkie: Adventures in Caring Too Much,1
"Blue Lily, Lily Blue (The Raven Cycle #3)",36
Booked,14
Critique of Pure Reason,30
"Data, A Love Story: How I Gamed Online Dating to Meet My Match",26
"Death Note, Vol. 5: Whiteout (Death Note #5)",10
Digital Fortress,0
Dracula the Un-Dead,0
Drama,0
Evicted: Poverty and Profit in the American City,25
Find Her (Detective D.D. Warren #8),18
Fool Me Once,0
Foundation (Foundation (Publication Order) #1),0
"Fruits Basket, Vol. 5 (Fruits Basket #5)",15
Some Women,0
The Beast (Black Dagger Brotherhood #14),0
The Bone Hunters (Lexy Vaughan & Steven Macaulay #2),0
"The Demon Prince of Momochi House, Vol. 4 (The Demon Prince of Momochi House #4)",4
The Demonists (Demonist #1),0
The Geography of Bliss: One Grump's Search for the Happiest Places in the World,17
The Gunning of America: Business and the Making of American Gun Culture,1
The Hound of the Baskervilles (Sherlock Holmes #5),0
The Hunger Games (The Hunger Games #1),26
The Jazz of Physics: The Secret Link Between Music and the Structure of the Universe,0
The Passion of Dolssa,0
The Perfect Play (Play by Play #1),26
The Pilgrim's Progress,3
The Shining (The Shining #1),0
Vogue Colors A to Z: A Fashion Coloring Book,14
A Clash of Kings (A Song of Ice and Fire #2),19
"Fruits Basket, Vol. 4 (Fruits Basket #4)",15
Girl With a Pearl Earring,7
God Is Not Great: How Religion Poisons Everything,16
Gone with the Wind,0
Harry Potter and the Chamber of Secrets (Harry Potter #2),12
Harry Potter and the Half-Blood Prince (Harry Potter #6),12
Harry Potter and the Order of the Phoenix (Harry Potter #5),12
Harry Potter and the Prisoner of Azkaban (Harry Potter #3),12
Harry Potter and the Sorcerer's Stone (Harry Potter #1),12
It,0
Little Women (Little Women #1),1
Misery,0
Mockingjay (The Hunger Games #3),26
Needful Things,0
Night Shift (Night Shift #1-20),9
No One Here Gets Out Alive,35
We Are All Completely Beside Ourselves,0
We the People: The Modern-Day Figures Who Have Reshaped and Affirmed the Founding Fathers' Vision of America,0
When You Are Engulfed in Flames,0
"Where'd You Go, Bernadette",0
Wild: From Lost to Found on the Pacific Crest Trail,0
World War Z: An Oral History of the Zombie War,17
Wuthering Heights,0
Zero History (Blue Ant #3),0
'Salem's Lot,3
"A History of God: The 4,000-Year Quest of Judaism, Christianity, and Islam",0
A New Earth: Awakening to Your Life's Purpose,3
A Walk to Remember,28
Animal Farm,20
Atlas Shrugged,0
Can You Keep a Secret?,0
Candide,0
The Smitten Kitchen Cookbook,0
The Stand,0
The Thing About Jellyfish,0
The Tipping Point: How Little Things Can Make a Big Difference,14
The Travelers,2
The Undomestic Goddess,0
"The Wicked + The Divine, Vol. 3: Commercial Suicide (The Wicked + The Divine)",4
The Wild Robot,0
"Thinking, Fast and Slow",0
Three-Martini Lunch,0
"Trespassing Across America: One Man's Epic, Never-Done-Before (and Sort of Illegal) Hike Across the Heartland",35
Twenties Girl,21
Twilight (Twilight #1),0
Two Boys Kissing,11
Under the Banner of Heaven: A Story of Violent Faith,0
"Unstuffed: Decluttering Your Home, Mind, and Soul",32
The Lonely Ones,35
The Lover's Dictionary,3
The Maze Runner (The Maze Runner #1),0
The Name of God is Mercy,0
The Nanny Diaries (Nanny #1),0
The New Guy (and Other Senior Year Distractions),3
The Nightingale,0
The Obsession,0
The Paris Wife,39
The Picture of Dorian Gray,0
The Purest Hook (Second Circle Tattoos #3),0
The Purpose Driven Life: What on Earth Am I Here for?,3
The Red Tent,22
The Rest Is Noise: Listening to the Twentieth Century,0
The Restaurant at the End of the Universe (Hitchhiker's Guide to the Galaxy #2),2
The Rise of Theodore Roosevelt (Theodore Roosevelt #1),22
The Day the Crayons Came Home (Crayons),13
The Demon-Haunted World: Science as a Candle in the Dark,17
